{
	"config" : {
		"datadir" : "/tmp/nsyslog",
		"input" : {"buffer" : 100}
	},

	"inputs" : {
		"lines" : {
			"type" : "file",
			"config" : {

				"path" : "/var/log/apache.log",
				"watch" : true,
				"readmode" : "watermark",
				"offset" : "end",
				"options": {
					"usePolling": true,
					"interval": 100
				}
			}
		}
	},

	"processors" : {},

	"transporters" : {
		"console" : {
			"type" : "console",
			"config" : {
				"format" : "${originalMessage}",
				"json" : {
					"format" : true,
					"spaces" : 2,
					"color" : true
				}
			}
		},
		"null" : {
			"type" : "null"
		}
	},

	"flows" : [
		{"id":"flow1", "from":"lines", "fork":false, "processors":[], "transporters":"null"}
	]
}
